{
  "title": "State of AI-Assisted Software Development",
  "subtitle": "2026 Industry Analysis and Adoption Trends",
  "author": "Meridian Research Group",
  "date": "April 2026",
  "version": "v1.0",
  "classification": "Public Release",
  "exec_summary": "AI-assisted software development has crossed the adoption chasm. Our analysis of 2,400 engineering organizations across 14 industries finds that 78% now use AI coding tools in production workflows, up from 31% in 2024. The median productivity gain reported is 32%, concentrated in boilerplate generation, test writing, and code review. However, the distribution is bimodal: organizations with mature engineering practices see 40-55% gains while those without see 10-15%. The difference is not the AI tool -- it is the human system around it. Context engineering, the discipline of structuring information for AI consumption, has emerged as the critical capability separating high and low performers. This report analyzes adoption patterns, productivity impacts, organizational maturity models, and provides a framework for maximizing returns on AI tooling investment.",
  "sections": [
    {
      "title": "Methodology",
      "content": "This report synthesizes data from three primary sources: a quantitative survey of 2,400 engineering organizations conducted January-March 2026, structured interviews with 85 engineering leaders at Fortune 500 companies, and telemetry analysis from anonymized usage data provided by three major AI coding tool vendors (covering 180,000 active developers). Survey respondents span 14 industries with company sizes ranging from 10-person startups to 200,000+ employee enterprises. All productivity claims are self-reported and triangulated against vendor telemetry where possible.",
      "subsections": [
        {
          "title": "Survey Design",
          "content": "The survey instrument included 42 questions across five categories: tool adoption, workflow integration, productivity measurement, organizational readiness, and future investment plans. Response rate was 34% from a stratified sample of 7,100 organizations. Statistical significance testing was performed at 95% confidence intervals for all reported findings."
        },
        {
          "title": "Limitations",
          "content": "Self-reported productivity gains may be subject to positive bias. Organizations that declined to participate may have systematically different experiences. Vendor telemetry data reflects tool usage but not necessarily code quality or business impact. We control for these limitations through triangulation and clearly indicate where findings are directional rather than definitive."
        }
      ]
    },
    {
      "title": "Adoption Landscape",
      "content": "AI coding tools have achieved mainstream adoption faster than any previous developer tooling category. The adoption curve compressed what historically took 8-10 years into 3 years, driven by the low friction of inline code completion and the immediate perceived productivity boost.",
      "subsections": [
        {
          "title": "Adoption by Company Size",
          "content": "Enterprise adoption (10,000+ employees) reached 82% in 2026, up from 28% in 2024. Mid-market (500-10,000) sits at 76%. Startups under 50 employees show the highest adoption at 91%, driven by resource constraints that make AI assistance particularly valuable. The laggards are mid-size companies in regulated industries (financial services, healthcare) where data governance concerns have slowed rollout."
        },
        {
          "title": "Adoption by Industry",
          "content": "Technology companies lead at 94% adoption. Financial services follows at 79% despite regulatory headwinds. Healthcare and life sciences sit at 62%, constrained by HIPAA and validation requirements. Government and defense trail at 41%, though adoption is accelerating rapidly following FedRAMP authorization of major AI coding platforms in late 2025."
        },
        {
          "title": "Tool Market Share",
          "content": "The market remains concentrated around three primary platforms that collectively serve 87% of active users. GitHub Copilot holds the largest share at 42%, followed by Cursor at 28% and Claude Code at 17%. The remaining 13% is fragmented across open-source alternatives and specialized vertical tools."
        }
      ]
    },
    {
      "title": "Productivity Impact Analysis",
      "content": "The headline finding is a median 32% self-reported productivity improvement across all respondents. However, this number masks significant variance that tells a more nuanced story about how AI tools interact with organizational maturity.",
      "subsections": [
        {
          "title": "The Bimodal Distribution",
          "content": "Productivity gains follow a bimodal distribution rather than a normal curve. The first peak centers around 12% improvement, representing organizations that adopted AI tools with minimal process changes. The second peak centers around 45%, representing organizations that restructured their development workflows around AI capabilities. The gap between these peaks is explained almost entirely by organizational practices, not tool selection."
        },
        {
          "title": "Task-Level Breakdown",
          "content": "AI-assisted gains vary dramatically by task type. Boilerplate and scaffolding code generation shows the highest gains (55-70% time reduction). Test writing sees 40-50% improvements. Code review and bug detection shows 30-40% gains. Architecture and system design shows only 5-15% improvement, suggesting AI tools are currently strongest at well-defined, pattern-matching tasks rather than novel design challenges."
        },
        {
          "title": "Context Engineering as Differentiator",
          "content": "Organizations in the top quartile of productivity gains share one common characteristic: they have invested in context engineering. This includes structured prompting guidelines, project-level AI configuration files, curated code examples and documentation for AI consumption, and systematic approaches to managing context windows. Teams that treat AI as a capable junior engineer who needs excellent onboarding consistently outperform those who treat it as an autocomplete tool."
        }
      ]
    },
    {
      "title": "Organizational Maturity Model",
      "content": "Based on our interview and survey data, we identified five distinct maturity levels for AI-assisted development adoption. Organizations progress through these stages sequentially, though the speed of progression varies significantly.",
      "subsections": [
        {
          "title": "Level 1: Individual Experimentation",
          "content": "Individual developers use AI tools on a personal basis without organizational support or governance. Productivity gains are inconsistent and untracked. This is where 15% of organizations currently sit."
        },
        {
          "title": "Level 2: Team Adoption",
          "content": "Teams formally adopt AI tools with basic guidelines. Licenses are managed centrally. Some productivity tracking begins. This is the current position of 28% of organizations."
        },
        {
          "title": "Level 3: Workflow Integration",
          "content": "AI tools are integrated into standard development workflows including CI/CD, code review, and testing pipelines. Context engineering practices begin to emerge. This represents 24% of organizations and is where the productivity curve begins to steepen."
        },
        {
          "title": "Level 4: Process Transformation",
          "content": "Development processes are redesigned around AI capabilities. Teams restructure code reviews, documentation, and knowledge management to maximize AI effectiveness. Context engineering becomes a formal discipline. Only 11% of organizations have reached this level."
        },
        {
          "title": "Level 5: Agentic Operations",
          "content": "AI agents operate semi-autonomously within well-defined guardrails, handling routine tasks end-to-end while humans focus on architecture, strategy, and edge cases. Only 2% of organizations (predominantly AI-native startups) currently operate at this level."
        }
      ]
    },
    {
      "title": "Investment and ROI",
      "content": "The median annual investment in AI coding tools per developer is $1,200 (tool licenses) plus $3,400 (training, process redesign, infrastructure). Organizations at Maturity Level 3+ report average ROI of 340% on their AI tooling investment within the first year, primarily driven by reduced time-to-delivery and lower defect rates in production.",
      "subsections": [
        {
          "title": "Cost Structure",
          "content": "Direct costs (licenses, API credits) represent only 26% of total AI tooling investment. The majority (74%) is indirect: engineering time for workflow redesign, training programs, context engineering infrastructure, and governance frameworks. Organizations that under-invest in the indirect costs consistently report lower productivity gains."
        },
        {
          "title": "ROI by Maturity Level",
          "content": "Level 1-2 organizations report average ROI of 80-120%, barely justifying the investment. Level 3 organizations see 250-350% ROI. Level 4-5 organizations report 500%+ ROI. The compounding effect of organizational learning means the gap between high and low maturity organizations widens over time, creating a strategic advantage that is difficult to close."
        }
      ]
    },
    {
      "title": "Recommendations",
      "content": "Based on our analysis, we recommend the following priorities for organizations seeking to maximize returns on AI-assisted development investment.",
      "subsections": [
        {
          "title": "For Level 1-2 Organizations",